Title,Company,Location,Description,Url,Source,CompanyLinkedInUrl,PeopleLinkedInUrl,RetrievedAt
Senior ASP.NET Developer,Acme Corporation,New York NY,"Looking for experienced ASP.NET developer with 5+ years of experience. Must know C# MVC and SQL Server.",https://www.indeed.com/viewjob?jk=abc123,indeed,https://www.linkedin.com/search/results/companies/?keywords=Acme%20Corporation,https://www.linkedin.com/search/results/people/?keywords=Acme%20Corporation,2025-10-12 12:30:00
.NET Full Stack Developer,TechCorp Inc,Remote,"Join our team building cloud-native applications. Experience with .NET Core Azure and React required.",https://www.indeed.com/viewjob?jk=def456,indeed,https://www.linkedin.com/search/results/companies/?keywords=TechCorp%20Inc,https://www.linkedin.com/search/results/people/?keywords=TechCorp%20Inc,2025-10-12 12:30:15
ASP.NET Core Engineer,Global Software Ltd,San Francisco CA,"We need a talented engineer to work on our enterprise platform. ASP.NET Core Web API Docker.",https://www.indeed.com/viewjob?jk=ghi789,indeed,https://www.linkedin.com/search/results/companies/?keywords=Global%20Software%20Ltd,https://www.linkedin.com/search/results/people/?keywords=Global%20Software%20Ltd,2025-10-12 12:30:30
Backend Developer - .NET,StartupXYZ,Austin TX,"Early stage startup looking for backend developer. .NET microservices AWS experience preferred.",https://www.indeed.com/viewjob?jk=jkl012,indeed,https://www.linkedin.com/search/results/companies/?keywords=StartupXYZ,https://www.linkedin.com/search/results/people/?keywords=StartupXYZ,2025-10-12 12:30:45
Principal Software Engineer,Enterprise Solutions Co,Chicago IL,"Lead our .NET team in building next-gen applications. 10+ years experience required. Architecture skills essential.",https://www.indeed.com/viewjob?jk=mno345,indeed,https://www.linkedin.com/search/results/companies/?keywords=Enterprise%20Solutions%20Co,https://www.linkedin.com/search/results/people/?keywords=Enterprise%20Solutions%20Co,2025-10-12 12:31:00
